{"canonical_files":[{"byte_length":2255,"path":"bundle/manifest.json","sha256":"e5dcd941bf3ba8a2513749de67ce857b30c412bebda3e80516a4a4442306d9ac"},{"byte_length":0,"path":"bundle/records.jsonl","sha256":"e3b0c44298fc1c149afbf4c8996fb92427ae41e4649b934ca495991b7852b855"},{"byte_length":698,"path":"evidence/capture-manifest.json","sha256":"f9108378f5382a9bef8979094d18665e09b9f4c8d9d477e3a0e26238480742f7"},{"byte_length":211,"path":"evidence/decisions.jsonl","sha256":"ff26205ba41ce9bb951dd428dd45b43ebe5d0bb0d6e6157ee5f54f0fc9131995"},{"byte_length":889,"path":"evidence/finalized-plan.json","sha256":"b2a4d53fdd2f91dcd0c5ff3510c61c2b0a7b9e2d641037af672193c135e68b25"},{"byte_length":2467,"path":"evidence/index.json","sha256":"db86e9d64aa42f2ffa44c3f7bec0e99a120c2c88fade871e9ecbf9aec1974db5"},{"byte_length":2517,"path":"evidence/interpretation.json","sha256":"0f0115daff7f211f7e1449120798cae7fd35838c3886ed0151c4b6071be21dc4"},{"byte_length":0,"path":"evidence/source-map.jsonl","sha256":"e3b0c44298fc1c149afbf4c8996fb92427ae41e4649b934ca495991b7852b855"}],"canonical_sha256":"3143ddb64f8c5941f674fd98eb6d7881d32875fee19aa41a1e9b8450cda9a98e","capture_sha256":"ac4b8ef4d26c5e87b1e21ef48b33a0aa89856778c09e14355a1b1a1722cf6d3c","coverage":"not_established","distinct_record_keys":0,"limits":{"candidates":5000,"depth":256,"input_bytes":8388608,"inspected_characters":120000,"nodes":100000,"output_bytes":67108864,"parts_per_record":128,"selector_work":1000000,"structured_data_bytes":262144,"tool_calls":64,"tool_characters":12000,"wall_seconds":60},"plan_id":"sha256:af3f43bd27a53854892eb2719110a1526189fd857723a556df497c63d466be1e","profile_sha256":"c3b177fe6d3465e6540a8282f31a057b2c1bcf9ca7bc120335d3d3b777aeb373","record_observations":0,"run_status_version":"1.0.0","status":"partial_execution","text_characters":0,"text_parts":0,"unsupported_contributions":1}
