{"canonical_files":[{"byte_length":2268,"path":"bundle/manifest.json","sha256":"4aa6a39ca12f9a1b6fe5108fe60b04511fbd50869a473fe5e68f11355d7ca91c"},{"byte_length":10666,"path":"bundle/records.jsonl","sha256":"31f002a94eb7aac0addf0e43731aa77ef70034f4526c97cb14d1cd96acdd0d4f"},{"byte_length":703,"path":"evidence/capture-manifest.json","sha256":"faebcb560804e52042021a7ee912be09a323106bc041690db37c2b10971b49ba"},{"byte_length":731,"path":"evidence/decisions.jsonl","sha256":"8cb5ee4a97b847d188166a2b3f343f40b0d477436ac345a449f3cdb5a734107b"},{"byte_length":6201,"path":"evidence/finalized-plan.json","sha256":"8699426f3ad5160d0c45800c2542128934f951575bbd128b35c5d6b20fc29229"},{"byte_length":20890,"path":"evidence/index.json","sha256":"e1011d02c9390acd0decb0a1660e3733eea7f813e68250a67ab85fee7b4cb718"},{"byte_length":6802,"path":"evidence/interpretation.json","sha256":"53341661a524a3f1e2b8bda68ba369d6f6f591cba2ac4441d620a6acd4868aa5"},{"byte_length":16600,"path":"evidence/source-map.jsonl","sha256":"12801e271ecd49ec4067bd638861258bb3831ac720de37b29f6a76c4a8335b95"}],"canonical_sha256":"166c0690848348c524969e8ed717df2989822a348dfd4cdc57a4f9cfa5b6f2ac","capture_sha256":"d8f46f535a4da215a9a767461f8076986a0b3b853ebfc7e4fccfe75ef74b6892","coverage":"not_established","distinct_record_keys":3,"limits":{"candidates":5000,"depth":256,"input_bytes":8388608,"inspected_characters":120000,"nodes":100000,"output_bytes":8388608,"parts_per_record":128,"selector_work":1000000,"structured_data_bytes":262144,"tool_calls":64,"tool_characters":12000,"wall_seconds":60},"plan_id":"sha256:dacced583d32e215b5382507d9c531ea1828378fae4fac55cdde16d3dacc9d79","profile_sha256":"c3b177fe6d3465e6540a8282f31a057b2c1bcf9ca7bc120335d3d3b777aeb373","record_observations":3,"run_status_version":"1.0.0","status":"complete_execution","text_characters":108,"text_parts":4,"unsupported_contributions":0}
