{"canonical_files":[{"byte_length":2255,"path":"bundle/manifest.json","sha256":"66802602058441ed208e6e3d63d3c73d1639ead24e3cb4e496ca92d376c4e35d"},{"byte_length":0,"path":"bundle/records.jsonl","sha256":"e3b0c44298fc1c149afbf4c8996fb92427ae41e4649b934ca495991b7852b855"},{"byte_length":698,"path":"evidence/capture-manifest.json","sha256":"2e3abb2fb68f53b79dce58b468f0850d2b6b25b2d8f10cea53748c2e97b44257"},{"byte_length":211,"path":"evidence/decisions.jsonl","sha256":"cc38fc852988e907444ccbb427e7a78a55d454d3424be5516390af15e4224136"},{"byte_length":1020,"path":"evidence/finalized-plan.json","sha256":"d9011b2a802742a0ed3199c82d4bdcc1bc73affbde84cf42fb3ed4bff482ac08"},{"byte_length":2503,"path":"evidence/index.json","sha256":"03d1f92a05d2269de23eb4df4e9a6922120a9900809c9cf02f2948d484b8462b"},{"byte_length":2517,"path":"evidence/interpretation.json","sha256":"e62794e3061be71fe680e3d09fd0267f22471b1d554af03501cd590ed8ff3b3e"},{"byte_length":0,"path":"evidence/source-map.jsonl","sha256":"e3b0c44298fc1c149afbf4c8996fb92427ae41e4649b934ca495991b7852b855"}],"canonical_sha256":"bf003708c0225f598e6218ed40288e8c52f8cdc6749e411d4bfb3ee6972d3ce8","capture_sha256":"e2b2ae7b95750ccaa8daf66145582d37df8833c0f41736a6f6c7ce4822395763","coverage":"not_established","distinct_record_keys":0,"limits":{"candidates":5000,"depth":256,"input_bytes":8388608,"inspected_characters":120000,"nodes":100000,"output_bytes":67108864,"parts_per_record":128,"selector_work":1000000,"structured_data_bytes":262144,"tool_calls":64,"tool_characters":12000,"wall_seconds":60},"plan_id":"sha256:2630efd980de54686b70a8eb441c16f0581f4f4521c56031bbec0bfab49de9da","profile_sha256":"c3b177fe6d3465e6540a8282f31a057b2c1bcf9ca7bc120335d3d3b777aeb373","record_observations":0,"run_status_version":"1.0.0","status":"partial_execution","text_characters":0,"text_parts":0,"unsupported_contributions":1}
