{"canonical_files":[{"byte_length":2263,"path":"bundle/manifest.json","sha256":"455af37ea6b7410851b064182bee4a50030b3ca37d29a540a5fe3b0ab0f60ec8"},{"byte_length":10769,"path":"bundle/records.jsonl","sha256":"73a602f026dfe8b9a5d6af6dbbb3a7d0094c155894ced26653e2459d8e9da35d"},{"byte_length":701,"path":"evidence/capture-manifest.json","sha256":"25589ed271ae618655a6068789682cc5cd7dc278ba03937c4bdb90889255daa0"},{"byte_length":732,"path":"evidence/decisions.jsonl","sha256":"3f05c27ed6ba524922fac0693bf737fe3ee110364b58557de5521df8dad30522"},{"byte_length":5291,"path":"evidence/finalized-plan.json","sha256":"a56b5954974d76132dce7857a58ed5dc054bed1be29ca4c28d15236a067af8d9"},{"byte_length":15754,"path":"evidence/index.json","sha256":"aedea2958142be680310b738fb9c95e451d09c928b329394cab3fe3fe60aab57"},{"byte_length":5233,"path":"evidence/interpretation.json","sha256":"4e670f8b84c3792cb91ca46f0c2c0c0f342280744334eb6acdd22cb6b6adfd27"},{"byte_length":16280,"path":"evidence/source-map.jsonl","sha256":"2252788dc810cfbade2fda7c51d10463272feda86b6b6dc04f03554f613903ed"}],"canonical_sha256":"1eeb298d207838673e881e1c36bc79db80da68840334751471db6cbf09b3ff78","capture_sha256":"736c38b80ebf96de5ace3516b87f34e502f5aa2b7db8c623ff45f45acc096d87","coverage":"not_established","distinct_record_keys":3,"limits":{"candidates":5000,"depth":256,"input_bytes":8388608,"inspected_characters":120000,"nodes":100000,"output_bytes":8388608,"parts_per_record":128,"selector_work":1000000,"structured_data_bytes":262144,"tool_calls":64,"tool_characters":12000,"wall_seconds":60},"plan_id":"sha256:59a27c756f485a5d23696bd3f6388648e1eb5438f7c39bd2f5c146cab07134af","profile_sha256":"c3b177fe6d3465e6540a8282f31a057b2c1bcf9ca7bc120335d3d3b777aeb373","record_observations":3,"run_status_version":"1.0.0","status":"complete_execution","text_characters":132,"text_parts":4,"unsupported_contributions":0}
