{"canonical_files":[{"byte_length":2258,"path":"bundle/manifest.json","sha256":"dab9c8b2fc99a3e800c3b80ffee8c9e7ca05d688ecf735b893a2dbcbd7659ec9"},{"byte_length":2862,"path":"bundle/records.jsonl","sha256":"36db5fb7bbb879bee95a2d9c1e5fc7b456a537411ac88bc6a7320dc3bf0d115f"},{"byte_length":698,"path":"evidence/capture-manifest.json","sha256":"33acac4d37e7dcc2c553496a19a65ef0ed0f9c6acc80254d5b0a10916fbcd5cf"},{"byte_length":243,"path":"evidence/decisions.jsonl","sha256":"0506c2dc913050278e17cd98e227b047d731f9c69feab4c2971c568771891ba0"},{"byte_length":854,"path":"evidence/finalized-plan.json","sha256":"143e5d7482af3f3b5d294b772864af691343e47c01edb53c2db62126eb24c6a0"},{"byte_length":2507,"path":"evidence/index.json","sha256":"b9455ec547d947826ed4780565301486d7dd8982787f8c7ac04274133afa1c89"},{"byte_length":2517,"path":"evidence/interpretation.json","sha256":"230e8c09f32d554af8bb0578754f87108a5030c420ab19b80820da0b8d423884"},{"byte_length":3061,"path":"evidence/source-map.jsonl","sha256":"a2ef04166be9a33377b9bc66cd2f33a19949a6c51b18b2ee94e320961ec7f08b"}],"canonical_sha256":"9cb81d6fbde168c7bba4fed83041f19ae45eefc448e54a50a96d1d0589348ec5","capture_sha256":"a913aa7711595bac048eff3b9866079370963003689d42c279bbd8fac6d4d331","coverage":"not_established","distinct_record_keys":1,"limits":{"candidates":5000,"depth":256,"input_bytes":8388608,"inspected_characters":120000,"nodes":100000,"output_bytes":67108864,"parts_per_record":128,"selector_work":1000000,"structured_data_bytes":262144,"tool_calls":64,"tool_characters":12000,"wall_seconds":60},"plan_id":"sha256:8db4a1cd0240b014bfed8be633dc1412e68b63fc4f84d0de486b7b8829ff9c94","profile_sha256":"c3b177fe6d3465e6540a8282f31a057b2c1bcf9ca7bc120335d3d3b777aeb373","record_observations":1,"run_status_version":"1.0.0","status":"complete_execution","text_characters":0,"text_parts":0,"unsupported_contributions":0}
