{"canonical_files":[{"byte_length":2258,"path":"bundle/manifest.json","sha256":"adb8803f7162d4e0896e6df72fc93239724458ba710d2a7841fe58e88024296c"},{"byte_length":2466,"path":"bundle/records.jsonl","sha256":"83ee108e0fea4ac7355384d82a344798ed189b0d6f8bffd2a7a4a5c4da38da3c"},{"byte_length":698,"path":"evidence/capture-manifest.json","sha256":"2e3abb2fb68f53b79dce58b468f0850d2b6b25b2d8f10cea53748c2e97b44257"},{"byte_length":243,"path":"evidence/decisions.jsonl","sha256":"946f7770faa2c935067d6ad409771c7844c108a36cec6f2c36777562577bbea6"},{"byte_length":1020,"path":"evidence/finalized-plan.json","sha256":"d9011b2a802742a0ed3199c82d4bdcc1bc73affbde84cf42fb3ed4bff482ac08"},{"byte_length":2503,"path":"evidence/index.json","sha256":"03d1f92a05d2269de23eb4df4e9a6922120a9900809c9cf02f2948d484b8462b"},{"byte_length":2091,"path":"evidence/interpretation.json","sha256":"7d7f318ef7a3ae40351b955fba6c825203b73216e2b8f457075fc98c3d7d04b7"},{"byte_length":2932,"path":"evidence/source-map.jsonl","sha256":"8d5c300acbe3b5d2a52a2b70abb2ad71242fc9b444b903f38a8fa9d33691a279"}],"canonical_sha256":"aba48af66a4a32bb5d13acc2cd43379162fbdad64b6f82255a9314fb1018dfee","capture_sha256":"e2b2ae7b95750ccaa8daf66145582d37df8833c0f41736a6f6c7ce4822395763","coverage":"not_established","distinct_record_keys":1,"limits":{"candidates":5000,"depth":256,"input_bytes":8388608,"inspected_characters":120000,"nodes":100000,"output_bytes":67108864,"parts_per_record":128,"selector_work":1000000,"structured_data_bytes":262144,"tool_calls":64,"tool_characters":12000,"wall_seconds":60},"plan_id":"sha256:2630efd980de54686b70a8eb441c16f0581f4f4521c56031bbec0bfab49de9da","profile_sha256":"c3b177fe6d3465e6540a8282f31a057b2c1bcf9ca7bc120335d3d3b777aeb373","record_observations":1,"run_status_version":"1.0.0","status":"complete_execution","text_characters":0,"text_parts":0,"unsupported_contributions":0}
