{"canonical_files":[{"byte_length":2264,"path":"bundle/manifest.json","sha256":"c5f709f9686852848379f8c6a2d13d06f502d4dc54f91a749e98af55a408cc0b"},{"byte_length":9870,"path":"bundle/records.jsonl","sha256":"c0b5d412dd3c0986527b172881b74ea36ae75852c980f787d8072c69bb0ff3aa"},{"byte_length":702,"path":"evidence/capture-manifest.json","sha256":"2f6ed64d5e36d3195f161dd7a5385a889bb208b451c7b4d38159558cfa9c9f0c"},{"byte_length":732,"path":"evidence/decisions.jsonl","sha256":"fa457b0834a0b0afa57c3e76a04c74f38879cc91b7ed045e593876c6a7bb4bef"},{"byte_length":4277,"path":"evidence/finalized-plan.json","sha256":"137e188685347fdec6e486f719cc93df880cc7b6299bd14ad25391cd54ccbc97"},{"byte_length":17383,"path":"evidence/index.json","sha256":"79015ea4a196fe6930c6737f222f67e50c72f4c68e958d8e115d6c506c79196a"},{"byte_length":5681,"path":"evidence/interpretation.json","sha256":"aa3671f805794768bffeb41ea69471080c929d496ab2279ffe51dcab463b3e85"},{"byte_length":13692,"path":"evidence/source-map.jsonl","sha256":"696c621677eb6d546e654110e2d2e6f4641b289a615a4646d10a4ba843bb7507"}],"canonical_sha256":"df570630ea10232c5a3a6ac011e94b970054ba15da60f08897a65afb30249df8","capture_sha256":"77f41cce4d10f55f51827cc21626fcdb75495ab893a7888902b2590830ede322","coverage":"not_established","distinct_record_keys":3,"limits":{"candidates":5000,"depth":256,"input_bytes":8388608,"inspected_characters":120000,"nodes":100000,"output_bytes":8388608,"parts_per_record":128,"selector_work":1000000,"structured_data_bytes":262144,"tool_calls":64,"tool_characters":12000,"wall_seconds":60},"plan_id":"sha256:9d1fd32a88fe8c6fa3edfc2abefc0abef2d1950de254cdd1bee0d19f8008557a","profile_sha256":"c3b177fe6d3465e6540a8282f31a057b2c1bcf9ca7bc120335d3d3b777aeb373","record_observations":3,"run_status_version":"1.0.0","status":"partial_execution","text_characters":68,"text_parts":3,"unsupported_contributions":0}
