{"canonical_files":[{"byte_length":2261,"path":"bundle/manifest.json","sha256":"ebb406c196d1ff9a1904eccb81a1d34bc53f87b2919793841ca31aa9a40ffefd"},{"byte_length":9939,"path":"bundle/records.jsonl","sha256":"1c4d8a582e2989cb0adb71121233be9515525920f0783628f34c1d1b2f6e479f"},{"byte_length":700,"path":"evidence/capture-manifest.json","sha256":"b4622d83fc594d07eb560cb3792fd80673ff839a941a80d4922e005264ccc375"},{"byte_length":731,"path":"evidence/decisions.jsonl","sha256":"9811f212a38b1513c5149b09a925d8e10b5f2491a70e7ebf69d52f0443a05d61"},{"byte_length":4606,"path":"evidence/finalized-plan.json","sha256":"b1bd31f542334b8ac650dde52bbe244b4cb35f27d39f68b9d35c7a40cb93f66b"},{"byte_length":13912,"path":"evidence/index.json","sha256":"62dc8ea60ff93e0b1c7dfb492fe56fe537370ae4e206a2f41fd9033499f18682"},{"byte_length":4848,"path":"evidence/interpretation.json","sha256":"b8285a7761a3cf045756f67815c769577e30c821c6b40a8f202e90683821fa52"},{"byte_length":13800,"path":"evidence/source-map.jsonl","sha256":"45bacfc884ed2f1db8545ab82f1bd78df261741a19fe38be824c8ef40f4ef036"}],"canonical_sha256":"e83013d805c998171f4c9ca254653f77e928554bade5a8d312b6eb5e0a8b7add","capture_sha256":"935d32c951cb5f5af1e77e0605f4f1e0056df091a36b80ea531dd31e7f0c4658","coverage":"not_established","distinct_record_keys":3,"limits":{"candidates":5000,"depth":256,"input_bytes":8388608,"inspected_characters":120000,"nodes":100000,"output_bytes":8388608,"parts_per_record":128,"selector_work":1000000,"structured_data_bytes":262144,"tool_calls":64,"tool_characters":12000,"wall_seconds":60},"plan_id":"sha256:6a242fc87a95f974e1f5626fa2e76878e490c4080d3b950c6b4766bbe0ea681f","profile_sha256":"c3b177fe6d3465e6540a8282f31a057b2c1bcf9ca7bc120335d3d3b777aeb373","record_observations":3,"run_status_version":"1.0.0","status":"complete_execution","text_characters":58,"text_parts":3,"unsupported_contributions":0}
