{"canonical_files":[{"byte_length":2265,"path":"bundle/manifest.json","sha256":"abe07e678d27b37ac147a7a93e6e741f24d719389733fec2707f244a685468f3"},{"byte_length":13965,"path":"bundle/records.jsonl","sha256":"7236da3cd97e3e952fd42d6c95dbb595eddd31cbc327b7644504f7507f20e99f"},{"byte_length":702,"path":"evidence/capture-manifest.json","sha256":"aa6f801466284a803dd32626f814edba098d2b8b2bccdaa36f0606f021487745"},{"byte_length":975,"path":"evidence/decisions.jsonl","sha256":"0ba1cbc5a5cd26b4b8e93ef9b4c60001fe11a17e5a8480faf11864af0faa837d"},{"byte_length":8560,"path":"evidence/finalized-plan.json","sha256":"70be01ba149a58f08ffa8df32131e11a89bf71e257d2c853d2729930e2875bf5"},{"byte_length":16305,"path":"evidence/index.json","sha256":"4eefce74f51f8bc452bce3599d44a4f2a46750d583f7b5b5ad755b612a0f16f5"},{"byte_length":5424,"path":"evidence/interpretation.json","sha256":"3431c81c5a9e20849ffe09cd4051abbbbbbfed756bbdec9b1dbc7eba7432f338"},{"byte_length":24229,"path":"evidence/source-map.jsonl","sha256":"d8852ea2b0a1fa1aab644be75ec754f46d8d6423b4980ecce2a56dc428586dc8"}],"canonical_sha256":"c6dde3d15dd247543b26f9de0bd4ac260e18f83ed29b2feaeaa7ba9e77e8f8dd","capture_sha256":"a0e2f0a5a7adf75968e0522fc7e905930755bfa6b3cf822c52cdec527ecfdbc5","coverage":"not_established","distinct_record_keys":4,"limits":{"candidates":5000,"depth":256,"input_bytes":8388608,"inspected_characters":120000,"nodes":100000,"output_bytes":8388608,"parts_per_record":128,"selector_work":1000000,"structured_data_bytes":262144,"tool_calls":64,"tool_characters":12000,"wall_seconds":60},"plan_id":"sha256:05dc8679f294d06ee141d03a4b25e08e0b49cee1c53f477a3e4301d603c1d158","profile_sha256":"c3b177fe6d3465e6540a8282f31a057b2c1bcf9ca7bc120335d3d3b777aeb373","record_observations":4,"run_status_version":"1.0.0","status":"partial_execution","text_characters":173,"text_parts":5,"unsupported_contributions":0}
