{"canonical_files":[{"byte_length":2264,"path":"bundle/manifest.json","sha256":"31b80ca565a30bbe50368b17c8a113c9703e36b7d2267fd0063bb7a0428f7b26"},{"byte_length":10104,"path":"bundle/records.jsonl","sha256":"2362bc90e9ed2b3ae600248d1ba4f0545ae45e27d6d2f287d15c910dc3ec204f"},{"byte_length":701,"path":"evidence/capture-manifest.json","sha256":"ba98fcbf3d2007d4af6d597e3bdba465dae75987a0955b2a20da78b2dacedcb6"},{"byte_length":732,"path":"evidence/decisions.jsonl","sha256":"804ef73d759c1cd0c2553bebb45d5e319755ee5bcb7f3da079540424a2f2941e"},{"byte_length":5328,"path":"evidence/finalized-plan.json","sha256":"af30604f8418acc2b6817334753d8ac35fc8445e288f456fd60d7c6f99d4a514"},{"byte_length":16559,"path":"evidence/index.json","sha256":"e958dbb5bca0f05909254371b02a1971ec019b0fcff88fcccf7bdfe022ca3fe9"},{"byte_length":5439,"path":"evidence/interpretation.json","sha256":"9e14282278474f4f906a9370aec195480942e0fdaa954ec555f830cdd01a2bea"},{"byte_length":15169,"path":"evidence/source-map.jsonl","sha256":"f86c0d354dbfca3dd4856ea5a3c75c7a1e49deaf2129adb5525b4a46ce6d9025"}],"canonical_sha256":"baff3033bd719062e2c0edfef94f93fbad1d8214c416c46de06b4d66b3faa767","capture_sha256":"47585c235b4775109546ee5a4152d19eb86d6e079b54c501e550779ff71d0b2e","coverage":"not_established","distinct_record_keys":3,"limits":{"candidates":5000,"depth":256,"input_bytes":8388608,"inspected_characters":120000,"nodes":100000,"output_bytes":8388608,"parts_per_record":128,"selector_work":1000000,"structured_data_bytes":262144,"tool_calls":64,"tool_characters":12000,"wall_seconds":60},"plan_id":"sha256:40555371479b18d02f327c0f5ae78f73bdb97d5ff92c85e24c9a061d5928d42e","profile_sha256":"c3b177fe6d3465e6540a8282f31a057b2c1bcf9ca7bc120335d3d3b777aeb373","record_observations":3,"run_status_version":"1.0.0","status":"complete_execution","text_characters":90,"text_parts":3,"unsupported_contributions":0}
