{"canonical_files":[{"byte_length":2265,"path":"bundle/manifest.json","sha256":"3da4a25041a52906d957cf58f75c4ed75f8e5732d04c5d9c262f5a988ad84aa2"},{"byte_length":14318,"path":"bundle/records.jsonl","sha256":"a2fa84146c8dfa589769b541722041fa55a79e09e4de7a5308f2788e3e7d0c11"},{"byte_length":702,"path":"evidence/capture-manifest.json","sha256":"2f6ed64d5e36d3195f161dd7a5385a889bb208b451c7b4d38159558cfa9c9f0c"},{"byte_length":976,"path":"evidence/decisions.jsonl","sha256":"8d2a5d7ab26b6db48c6d1d2aefbe8a8e02aecc7e21d96e5eb3e01b6f15ea9c40"},{"byte_length":6156,"path":"evidence/finalized-plan.json","sha256":"d1c26d62b4ce9881fd2104b1e2fa8d57b786b54c497f971c8163f65de2ee9513"},{"byte_length":17383,"path":"evidence/index.json","sha256":"79015ea4a196fe6930c6737f222f67e50c72f4c68e958d8e115d6c506c79196a"},{"byte_length":5655,"path":"evidence/interpretation.json","sha256":"b49b5fcaeb1dd00d8ac7ad3c10bc62da5f9a2ef7398b34c135a2a41f3b53db8c"},{"byte_length":21187,"path":"evidence/source-map.jsonl","sha256":"c676a9b8a1a305ed7c8e32a58e8ee25d46bbf336fc1ca62f0bd0d925e690c66a"}],"canonical_sha256":"18de94b83f3b6c2b6a41c2399885d6632a8d58f13f04cc4fce8212df0b282a54","capture_sha256":"77f41cce4d10f55f51827cc21626fcdb75495ab893a7888902b2590830ede322","coverage":"not_established","distinct_record_keys":4,"limits":{"candidates":5000,"depth":256,"input_bytes":8388608,"inspected_characters":120000,"nodes":100000,"output_bytes":8388608,"parts_per_record":128,"selector_work":1000000,"structured_data_bytes":262144,"tool_calls":64,"tool_characters":12000,"wall_seconds":60},"plan_id":"sha256:24d0a7753790e1717bca7621cd4c0c33eab02c701368181ab7bcb968789688d2","profile_sha256":"c3b177fe6d3465e6540a8282f31a057b2c1bcf9ca7bc120335d3d3b777aeb373","record_observations":4,"run_status_version":"1.0.0","status":"partial_execution","text_characters":194,"text_parts":6,"unsupported_contributions":0}
