{"canonical_files":[{"byte_length":2263,"path":"bundle/manifest.json","sha256":"b543d4f8cebd6a9dbdf8dd9431282d71de640b052bf8293a2013dc0ad7869a19"},{"byte_length":9853,"path":"bundle/records.jsonl","sha256":"ff4075a562da57aac9b00f669dcb21254d3a1d27cdb2cf45f74ad1d1b0d8d1cb"},{"byte_length":701,"path":"evidence/capture-manifest.json","sha256":"321a4c7a7526b597c5cf236b000bbea6580287bb06ef17a8acabfd54cb06837c"},{"byte_length":732,"path":"evidence/decisions.jsonl","sha256":"0bac0d6624e5a28261ecf30236e2d9e0bbc75713b5f3cef1aa1a6e66098c16f8"},{"byte_length":4046,"path":"evidence/finalized-plan.json","sha256":"a45fd775cb9b61201f2f02ce3597e21f68e27c4edef2c9ad173d6d2d758f02b2"},{"byte_length":15434,"path":"evidence/index.json","sha256":"8a7b1ca7491b1f7c8f9308ea2391fff722a9ed9a4ff8271f6092791de56534a1"},{"byte_length":5208,"path":"evidence/interpretation.json","sha256":"4adfa81c57cb0467e675e4be96a9ae9706472b13cb6719a8bc232bd6aa85ccf9"},{"byte_length":13494,"path":"evidence/source-map.jsonl","sha256":"ef2f3527ba07f2a98204c26ed9613d8f901e6d2b2abace826f9572b7afba10a4"}],"canonical_sha256":"a4e9cf91943d695986cb6ae3a99ad30901ce7f2aa6cb32eeb288f28ce2b814d6","capture_sha256":"9856eedbcadce0f41f82958a60a0d917ba9ca03db4d9f5e4b87095f4f613a253","coverage":"not_established","distinct_record_keys":3,"limits":{"candidates":5000,"depth":256,"input_bytes":8388608,"inspected_characters":120000,"nodes":100000,"output_bytes":8388608,"parts_per_record":128,"selector_work":1000000,"structured_data_bytes":262144,"tool_calls":64,"tool_characters":12000,"wall_seconds":60},"plan_id":"sha256:ebd766c7c3c3899f7d1ba12977fbd0942773c4626f0eb51aa01288033615a34f","profile_sha256":"c3b177fe6d3465e6540a8282f31a057b2c1bcf9ca7bc120335d3d3b777aeb373","record_observations":3,"run_status_version":"1.0.0","status":"complete_execution","text_characters":63,"text_parts":3,"unsupported_contributions":0}
