{"canonical_files":[{"byte_length":2263,"path":"bundle/manifest.json","sha256":"32972c542728386009a06c71af314ac00a2100de7b94d75af520f6d5cda97ca4"},{"byte_length":10510,"path":"bundle/records.jsonl","sha256":"602913d6241cef84ba4d2efcf1560a3113c0626a3929c778b984bb8636c41912"},{"byte_length":701,"path":"evidence/capture-manifest.json","sha256":"25589ed271ae618655a6068789682cc5cd7dc278ba03937c4bdb90889255daa0"},{"byte_length":732,"path":"evidence/decisions.jsonl","sha256":"27871d3baade3c2eb424dc082ba8c36b171f32686daac0ce0287a3f2f5e4ead1"},{"byte_length":5332,"path":"evidence/finalized-plan.json","sha256":"a1a5ad50a8ea2f487750e1b33411c94b46ae7688b42b5edee6b9cfc02f4175ae"},{"byte_length":15754,"path":"evidence/index.json","sha256":"aedea2958142be680310b738fb9c95e451d09c928b329394cab3fe3fe60aab57"},{"byte_length":5233,"path":"evidence/interpretation.json","sha256":"250d6007225011dcababacdf6a0baa7ad7e8676e6e085e0f4fc40663389b58b6"},{"byte_length":16952,"path":"evidence/source-map.jsonl","sha256":"a27dc1f75b266e126122e745c125b91283f242c6ce3139740572105080c82188"}],"canonical_sha256":"c0c1a8162aeed9753ad60d165ae8ea66b552b8058d440be637c3eb92e77aa253","capture_sha256":"736c38b80ebf96de5ace3516b87f34e502f5aa2b7db8c623ff45f45acc096d87","coverage":"not_established","distinct_record_keys":3,"limits":{"candidates":5000,"depth":256,"input_bytes":8388608,"inspected_characters":120000,"nodes":100000,"output_bytes":8388608,"parts_per_record":128,"selector_work":1000000,"structured_data_bytes":262144,"tool_calls":64,"tool_characters":12000,"wall_seconds":60},"plan_id":"sha256:af304f55f9af47b54f82a0e84e01d0a39ad45689bfc9b5558fc601ab20064bb4","profile_sha256":"c3b177fe6d3465e6540a8282f31a057b2c1bcf9ca7bc120335d3d3b777aeb373","record_observations":3,"run_status_version":"1.0.0","status":"complete_execution","text_characters":132,"text_parts":4,"unsupported_contributions":0}
