{"canonical_files":[{"byte_length":2259,"path":"bundle/manifest.json","sha256":"15ad2e8f1664234bcb0011314273966b1cce1f07ccf7f4b0c2b136d0d7024df9"},{"byte_length":4263,"path":"bundle/records.jsonl","sha256":"cf915a928ba1a4b13f89f841c51dd458413518faff1cf9638f2c3b03cd2d9eb5"},{"byte_length":699,"path":"evidence/capture-manifest.json","sha256":"e98b1ccafdd35ee0839ed87e4e88dcfb30abc3becad864046ba41206c32f93af"},{"byte_length":243,"path":"evidence/decisions.jsonl","sha256":"37b77320f5174e68e0116070c9e4a47c15a670a087503e633827ffc964a8946e"},{"byte_length":1273,"path":"evidence/finalized-plan.json","sha256":"5b9594bb08e3f5c8ef6fe375158299993ea2bb5a890a965c3de6da3352472f00"},{"byte_length":5275,"path":"evidence/index.json","sha256":"0cd3004c8d136fb2a595795c5babd2326b2b5fc8c7a3d3c24eb85c61d79ef7df"},{"byte_length":3129,"path":"evidence/interpretation.json","sha256":"0d9af58c2b0f4b0b47f6b576a9ee6e795b48791be870ac883a40f4422260cc65"},{"byte_length":6435,"path":"evidence/source-map.jsonl","sha256":"0fd1d081ff1b7293e31f4174c8ebb4386363975481b07c9dc6a54417746b38bf"}],"canonical_sha256":"9d89b873530e73eac962f06f78ef4abd71ab5e2d5994b23a98cf3d2af8083f6c","capture_sha256":"2ef6e6ad856664f7cd792cbe82143fbdf797c4ebe75d42a76b059d4cd890f60f","coverage":"not_established","distinct_record_keys":1,"limits":{"candidates":5000,"depth":256,"input_bytes":8388608,"inspected_characters":120000,"nodes":100000,"output_bytes":67108864,"parts_per_record":128,"selector_work":1000000,"structured_data_bytes":262144,"tool_calls":64,"tool_characters":12000,"wall_seconds":60},"plan_id":"sha256:5ceb8b738c7e3dbb3d21f1322ae3a7c6a7fde2c4bb1aae4ff99b03219dd733f5","profile_sha256":"c3b177fe6d3465e6540a8282f31a057b2c1bcf9ca7bc120335d3d3b777aeb373","record_observations":1,"run_status_version":"1.0.0","status":"complete_execution","text_characters":20,"text_parts":3,"unsupported_contributions":0}
